{
  "user_id": "u_001",
  "name": "Alex Runner",
  "age": 32,
  "sex": "male",
  "height_cm": 178.0,
  "weight_kg": 74.0,
  "goal": "maintain",
  "dietary_preferences": [
    "high-protein",
    "mediterranean"
  ],
  "allergies": [
    "peanuts"
  ],
  "avoid_list": [
    "peanuts",
    "lamb"
  ],
  "cooking_time_max_min": 30,
  "budget_level": "medium"
}