{
  "user_id": "user_001",
  "name": "Nathan F",
  "age": 45,
  "sex": "male",
  "height_cm": 172.7,
  "weight_kg": 67.6,
  "goal": "maintain",
  "dietary_preferences": [
    "omnivore",
    "mediterranean",
    "high-protein",
    "whole-foods"
  ],
  "avoid_list": [
    "whole tomato",
    "spicy food",
    "bell peppers",
    "raw white onion"
  ],
  "allergies": [],
  "cooking_time_max_min": 90,
  "budget_level": "high",
  "body_fat_pct": 11.0,
  "ftp_w": 220
}